<?xml version="1.0" encoding="UTF-8" ?>
<ots:LINKTYPES xmlns:ots="http://www.opentrafficsim.org/ots" xmlns:xsi="http://www.w3.org/2001/XMLSchema-instance" 
  xsi:schemaLocation="http://www.opentrafficsim.org/ots ../ots-definitions.xsd
  http://www.opentrafficsim.org/ots https://opentrafficsim.org/docs/xsd/1.01.02/ots-definitions.xsd">
  
  <!-- 
    GTUCompatibility<LinkType> compatibility = new GTUCompatibility<>((LinkType) null); 
    NONE = new LinkType("NONE", null, compatibility); 
    // 
    compatibility = new GTUCompatibility<>((LinkType) null); 
    compatibility.addAllowedGTUType(GTUType.ROAD_USER, LongitudinalDirectionality.DIR_BOTH); 
    ROAD = new LinkType("ROAD", null, compatibility); 
    // 
    compatibility = new GTUCompatibility<>((LinkType) null); 
    compatibility.addAllowedGTUType(GTUType.ROAD_USER, LongitudinalDirectionality.DIR_PLUS); 
    compatibility.addAllowedGTUType(GTUType.PEDESTRIAN, LongitudinalDirectionality.DIR_NONE); 
    compatibility.addAllowedGTUType(GTUType.BICYCLE, LongitudinalDirectionality.DIR_NONE); 
    FREEWAY = new LinkType("FREEWAY", ROAD, compatibility); 
    // 
    compatibility = new GTUCompatibility<>((LinkType) null); 
    compatibility.addAllowedGTUType(GTUType.WATERWAY_USER, LongitudinalDirectionality.DIR_BOTH); 
    WATERWAY = new LinkType("WATERWAY", null, compatibility); 
    // 
    compatibility = new GTUCompatibility<>((LinkType) null); 
    compatibility.addAllowedGTUType(GTUType.RAILWAY_USER, LongitudinalDirectionality.DIR_BOTH); 
    RAILWAY = new LinkType("RAILWAY", null, compatibility); 
    // 
    compatibility = new GTUCompatibility<>((LinkType) null); 
    compatibility.addAllowedGTUType(GTUType.ROAD_USER, LongitudinalDirectionality.DIR_PLUS); 
    compatibility.addAllowedGTUType(GTUType.WATERWAY_USER, LongitudinalDirectionality.DIR_PLUS); 
    compatibility.addAllowedGTUType(GTUType.RAILWAY_USER, LongitudinalDirectionality.DIR_PLUS); 
    CONNECTOR = new LinkType("CONNECTOR", null, compatibility); 
  -->

  <ots:LINKTYPE NAME="NONE" DEFAULT="true" />

  <ots:LINKTYPE NAME="ROAD" DEFAULT="true">
    <ots:COMPATIBILITY GTUTYPE="ROAD_USER" DIRECTION="BOTH" />
  </ots:LINKTYPE>

  <ots:LINKTYPE NAME="FREEWAY" PARENT="ROAD" DEFAULT="true">
    <ots:COMPATIBILITY GTUTYPE="ROAD_USER" DIRECTION="FORWARD" />
    <ots:COMPATIBILITY GTUTYPE="PEDESTRIAN" DIRECTION="NONE" />
    <ots:COMPATIBILITY GTUTYPE="BICYCLE" DIRECTION="NONE" />
  </ots:LINKTYPE>

  <ots:LINKTYPE NAME="WATERWAY" DEFAULT="true">
    <ots:COMPATIBILITY GTUTYPE="WATERWAY_USER" DIRECTION="BOTH" />
  </ots:LINKTYPE>

  <ots:LINKTYPE NAME="RAILWAY" DEFAULT="true">
    <ots:COMPATIBILITY GTUTYPE="RAILWAY_USER" DIRECTION="BOTH" />
  </ots:LINKTYPE>

  <ots:LINKTYPE NAME="CONNECTOR" DEFAULT="true">
    <ots:COMPATIBILITY GTUTYPE="ROAD_USER" DIRECTION="FORWARD" />
    <ots:COMPATIBILITY GTUTYPE="WATERWAY_USER" DIRECTION="FORWARD" />
    <ots:COMPATIBILITY GTUTYPE="RAILWAY_USER" DIRECTION="FORWARD" />
  </ots:LINKTYPE>
</ots:LINKTYPES>
